{
  "$schema": "./release.schema.json",
  "schemaVersion": 1,
  "tools": {
    "node": "26.12.1",
    "pnpm": "12.15.0",
    "python": "3.15.1",
    "uv": "0.13.5",
    "expo": "58.0.17"
  },
  "gis": {
    "gdal": "3.13.3",
    "postgis": "3.6.4",
    "sqlite": "3.54.1"
  },
  "ios": {
    "deploymentTarget": "16.4",
    "runner": "xcode-27",
    "xcode": "27.1",
    "cocoapods": "1.17.0"
  },
  "channels": {
    "public": {
      "appName": "Open Outdoor",
      "bundleIdentifier": "org.openoutdoor.public",
      "trustRoot": "public-v1"
    },
    "local": {
      "appName": "Open Outdoor Local",
      "bundleIdentifier": "org.openoutdoor.local",
      "trustRoot": "local-development"
    },
    "private": {
      "appName": "Open Outdoor Private",
      "bundleIdentifier": "org.openoutdoor.private",
      "trustRoot": "private-external"
    }
  },
  "regions": ["US-NY"],
  "schemas": { "catalog": 1, "backup": 2 },
  "phase0": {
    "profileId": "iphone14-ios26.6-phase0-v1",
    "referenceDevice": { "model": "iPhone 14", "os": "iOS 26.6" },
    "tracker": {
      "batchMaximumSeconds": 30,
      "recordingControlP95Ms": 500,
      "maximumCommittedDataGapSeconds": 30,
      "maximumCommittedDataGapBatches": 1,
      "screenOffResidentMemoryP95MiB": 150,
      "energyPolicy": {
        "acceptancePhase": "deferred-field-hardening",
        "deferredWorkPackages": ["WP-307", "WP-503"],
        "sensorsOnlyDuringActiveRecording": true,
        "continuousPollingAllowed": false,
        "highAccuracyRequiresExplicitSelection": true,
        "balancedDistanceFilterMeters": 10,
        "enduranceDistanceFilterMeters": 25
      }
    },
    "catalog": {
      "combinedInstalledMaximumBytes": 3221225472,
      "minimumWorkspaceBytes": 1073741824,
      "postActivationReserveBytes": 2147483648
    }
  },
  "phase3": {
    "fieldProfileId": "iphone14-ios26.6-phase3-v1",
    "referenceDevice": { "model": "iPhone 14", "os": "iOS 26.6" },
    "requiredRunsPerMode": 3,
    "requiredModes": ["balanced", "endurance"],
    "minimumDurationMinutes": 180,
    "maximumBatteryPercentPerHour": { "balanced": 6, "endurance": 4 },
    "maximumSeriousThermalSeconds": 0,
    "maximumCriticalThermalSeconds": 0,
    "maximumCheckpointGapSeconds": 30,
    "maximumStorageGrowthMiBPerHour": 64,
    "enduranceDisposition": {
      "phase3": "conditionally-approved",
      "blockingPhase": "Phase 5",
      "blockingWorkPackage": "WP-503",
      "enduranceClaimsAllowed": false
    }
  },
  "productionQuality": {
    "profile": "production-quality-profile.json",
    "physicalAcceptance": "end-of-phase5",
    "decision": "ADR-049",
    "blockingWorkPackage": "WP-506"
  },
  "budgets": {
    "diagnosticRetentionHours": 24,
    "publicArtifactRetentionDays": 1,
    "ciMaximumMinutes": 30
  }
}
